<?xml version="1.0"?>
<?xml-stylesheet type="text/xsl" href="pdml2html.xsl"?>
<!-- You can find pdml2html.xsl in /usr/share/wireshark or at http://anonsvn.wireshark.org/trunk/wireshark/pdml2html.xsl. -->
<pdml version="0" creator="wireshark/1.6.2" time="Fri Apr 20 09:11:02 2012" capture_file="">
<packet>
  <proto name="geninfo" pos="0" showname="General information" size="74">
    <field name="num" pos="0" show="1" showname="Number" value="1" size="74"/>
    <field name="len" pos="0" show="74" showname="Frame Length" value="4a" size="74"/>
    <field name="caplen" pos="0" show="74" showname="Captured Length" value="4a" size="74"/>
    <field name="timestamp" pos="0" show="Apr 20, 2012 09:11:07.454194000 CEST" showname="Captured Time" value="1334905867.454194000" size="74"/>
  </proto>
  <proto name="frame" showname="Frame 1: 74 bytes on wire (592 bits), 74 bytes captured (592 bits)" size="74" pos="0">
    <field name="frame.time" showname="Arrival Time: Apr 20, 2012 09:11:07.454194000 CEST" size="0" pos="0" show="Apr 20, 2012 09:11:07.454194000"/>
    <field name="frame.time_epoch" showname="Epoch Time: 1334905867.454194000 seconds" size="0" pos="0" show="1334905867.454194000"/>
    <field name="frame.time_delta" showname="Time delta from previous captured frame: 0.000000000 seconds" size="0" pos="0" show="0.000000000"/>
    <field name="frame.time_delta_displayed" showname="Time delta from previous displayed frame: 0.000000000 seconds" size="0" pos="0" show="0.000000000"/>
    <field name="frame.time_relative" showname="Time since reference or first frame: 0.000000000 seconds" size="0" pos="0" show="0.000000000"/>
    <field name="frame.number" showname="Frame Number: 1" size="0" pos="0" show="1"/>
    <field name="frame.len" showname="Frame Length: 74 bytes (592 bits)" size="0" pos="0" show="74"/>
    <field name="frame.cap_len" showname="Capture Length: 74 bytes (592 bits)" size="0" pos="0" show="74"/>
    <field name="frame.marked" showname="Frame is marked: False" size="0" pos="0" show="0"/>
    <field name="frame.ignored" showname="Frame is ignored: False" size="0" pos="0" show="0"/>
    <field name="frame.protocols" showname="Protocols in frame: eth:ip:tcp" size="0" pos="0" show="eth:ip:tcp"/>
  </proto>
  <proto name="eth" showname="Ethernet II, Src: 00:00:00_00:00:00 (00:00:00:00:00:00), Dst: 00:00:00_00:00:00 (00:00:00:00:00:00)" size="14" pos="0">
    <field name="eth.dst" showname="Destination: 00:00:00_00:00:00 (00:00:00:00:00:00)" size="6" pos="0" show="00:00:00:00:00:00" value="000000000000">
      <field name="eth.addr" showname="Address: 00:00:00_00:00:00 (00:00:00:00:00:00)" size="6" pos="0" show="00:00:00:00:00:00" value="000000000000"/>
      <field name="eth.ig" showname=".... ...0 .... .... .... .... = IG bit: Individual address (unicast)" size="3" pos="0" show="0" value="0" unmaskedvalue="000000"/>
      <field name="eth.lg" showname=".... ..0. .... .... .... .... = LG bit: Globally unique address (factory default)" size="3" pos="0" show="0" value="0" unmaskedvalue="000000"/>
    </field>
    <field name="eth.src" showname="Source: 00:00:00_00:00:00 (00:00:00:00:00:00)" size="6" pos="6" show="00:00:00:00:00:00" value="000000000000">
      <field name="eth.addr" showname="Address: 00:00:00_00:00:00 (00:00:00:00:00:00)" size="6" pos="6" show="00:00:00:00:00:00" value="000000000000"/>
      <field name="eth.ig" showname=".... ...0 .... .... .... .... = IG bit: Individual address (unicast)" size="3" pos="6" show="0" value="0" unmaskedvalue="000000"/>
      <field name="eth.lg" showname=".... ..0. .... .... .... .... = LG bit: Globally unique address (factory default)" size="3" pos="6" show="0" value="0" unmaskedvalue="000000"/>
    </field>
    <field name="eth.type" showname="Type: IP (0x0800)" size="2" pos="12" show="0x0800" value="0800"/>
  </proto>
  <proto name="ip" showname="Internet Protocol Version 4, Src: 127.0.0.1 (127.0.0.1), Dst: 127.0.0.1 (127.0.0.1)" size="20" pos="14">
    <field name="ip.version" showname="Version: 4" size="1" pos="14" show="4" value="45"/>
    <field name="ip.hdr_len" showname="Header length: 20 bytes" size="1" pos="14" show="20" value="45"/>
    <field name="ip.dsfield" showname="Differentiated Services Field: 0x00 (DSCP 0x00: Default; ECN: 0x00: Not-ECT (Not ECN-Capable Transport))" size="1" pos="15" show="0" value="00">
      <field name="ip.dsfield.dscp" showname="0000 00.. = Differentiated Services Codepoint: Default (0x00)" size="1" pos="15" show="0x00" value="0" unmaskedvalue="00"/>
      <field name="ip.dsfield.ecn" showname=".... ..00 = Explicit Congestion Notification: Not-ECT (Not ECN-Capable Transport) (0x00)" size="1" pos="15" show="0x00" value="0" unmaskedvalue="00"/>
    </field>
    <field name="ip.len" showname="Total Length: 60" size="2" pos="16" show="60" value="003c"/>
    <field name="ip.id" showname="Identification: 0x1e55 (7765)" size="2" pos="18" show="0x1e55" value="1e55"/>
    <field name="ip.flags" showname="Flags: 0x02 (Don&apos;t Fragment)" size="1" pos="20" show="0x02" value="40">
      <field name="ip.flags.rb" showname="0... .... = Reserved bit: Not set" size="1" pos="20" show="0" value="40"/>
      <field name="ip.flags.df" showname=".1.. .... = Don&apos;t fragment: Set" size="1" pos="20" show="1" value="40"/>
      <field name="ip.flags.mf" showname="..0. .... = More fragments: Not set" size="1" pos="20" show="0" value="40"/>
    </field>
    <field name="ip.frag_offset" showname="Fragment offset: 0" size="2" pos="20" show="0" value="4000"/>
    <field name="ip.ttl" showname="Time to live: 64" size="1" pos="22" show="64" value="40"/>
    <field name="ip.proto" showname="Protocol: TCP (6)" size="1" pos="23" show="6" value="06"/>
    <field name="ip.checksum" showname="Header checksum: 0x1e65 [correct]" size="2" pos="24" show="0x1e65" value="1e65">
      <field name="ip.checksum_good" showname="Good: True" size="2" pos="24" show="1" value="1e65"/>
      <field name="ip.checksum_bad" showname="Bad: False" size="2" pos="24" show="0" value="1e65"/>
    </field>
    <field name="ip.src" showname="Source: 127.0.0.1 (127.0.0.1)" size="4" pos="26" show="127.0.0.1" value="7f000001"/>
    <field name="ip.addr" showname="Source or Destination Address: 127.0.0.1 (127.0.0.1)" hide="yes" size="4" pos="26" show="127.0.0.1" value="7f000001"/>
    <field name="ip.src_host" showname="Source Host: 127.0.0.1" hide="yes" size="4" pos="26" show="127.0.0.1" value="7f000001"/>
    <field name="ip.host" showname="Source or Destination Host: 127.0.0.1" hide="yes" size="4" pos="26" show="127.0.0.1" value="7f000001"/>
    <field name="ip.dst" showname="Destination: 127.0.0.1 (127.0.0.1)" size="4" pos="30" show="127.0.0.1" value="7f000001"/>
    <field name="ip.addr" showname="Source or Destination Address: 127.0.0.1 (127.0.0.1)" hide="yes" size="4" pos="30" show="127.0.0.1" value="7f000001"/>
    <field name="ip.dst_host" showname="Destination Host: 127.0.0.1" hide="yes" size="4" pos="30" show="127.0.0.1" value="7f000001"/>
    <field name="ip.host" showname="Source or Destination Host: 127.0.0.1" hide="yes" size="4" pos="30" show="127.0.0.1" value="7f000001"/>
  </proto>
  <proto name="tcp" showname="Transmission Control Protocol, Src Port: 37092 (37092), Dst Port: http (80), Seq: 0, Len: 0" size="40" pos="34">
    <field name="tcp.srcport" showname="Source port: 37092 (37092)" size="2" pos="34" show="37092" value="90e4"/>
    <field name="tcp.dstport" showname="Destination port: http (80)" size="2" pos="36" show="80" value="0050"/>
    <field name="tcp.port" showname="Source or Destination Port: 37092" hide="yes" size="2" pos="34" show="37092" value="90e4"/>
    <field name="tcp.port" showname="Source or Destination Port: 80" hide="yes" size="2" pos="36" show="80" value="0050"/>
    <field name="tcp.stream" showname="Stream index: 0" size="0" pos="34" show="0"/>
    <field name="tcp.len" showname="TCP Segment Len: 0" hide="yes" size="1" pos="46" show="0" value="a0"/>
    <field name="tcp.seq" showname="Sequence number: 0    (relative sequence number)" size="4" pos="38" show="0" value="563d3d0b"/>
    <field name="tcp.hdr_len" showname="Header length: 40 bytes" size="1" pos="46" show="40" value="a0"/>
    <field name="tcp.flags" showname="Flags: 0x02 (SYN)" size="2" pos="46" show="0x02" value="a002">
      <field name="tcp.flags.res" showname="000. .... .... = Reserved: Not set" size="1" pos="46" show="0" value="0" unmaskedvalue="a0"/>
      <field name="tcp.flags.ns" showname="...0 .... .... = Nonce: Not set" size="1" pos="46" show="0" value="0" unmaskedvalue="a0"/>
      <field name="tcp.flags.cwr" showname=".... 0... .... = Congestion Window Reduced (CWR): Not set" size="1" pos="47" show="0" value="0" unmaskedvalue="02"/>
      <field name="tcp.flags.ecn" showname=".... .0.. .... = ECN-Echo: Not set" size="1" pos="47" show="0" value="0" unmaskedvalue="02"/>
      <field name="tcp.flags.urg" showname=".... ..0. .... = Urgent: Not set" size="1" pos="47" show="0" value="0" unmaskedvalue="02"/>
      <field name="tcp.flags.ack" showname=".... ...0 .... = Acknowledgement: Not set" size="1" pos="47" show="0" value="0" unmaskedvalue="02"/>
      <field name="tcp.flags.push" showname=".... .... 0... = Push: Not set" size="1" pos="47" show="0" value="0" unmaskedvalue="02"/>
      <field name="tcp.flags.reset" showname=".... .... .0.. = Reset: Not set" size="1" pos="47" show="0" value="0" unmaskedvalue="02"/>
      <field name="tcp.flags.syn" showname=".... .... ..1. = Syn: Set" size="1" pos="47" show="1" value="1" unmaskedvalue="02">
        <proto name="expert" showname="Expert Info (Chat/Sequence): Connection establish request (SYN): server port http" size="0" pos="0">
          <field name="expert.message" showname="Message: Connection establish request (SYN): server port http" size="0" pos="0" show="Connection establish request (SYN): server port http"/>
          <field name="expert.severity" showname="Severity level: Chat" size="0" pos="0" show="Chat"/>
          <field name="expert.group" showname="Group: Sequence" size="0" pos="0" show="Sequence"/>
        </proto>
      </field>
      <field name="tcp.flags.fin" showname=".... .... ...0 = Fin: Not set" size="1" pos="47" show="0" value="0" unmaskedvalue="02"/>
    </field>
    <field name="tcp.window_size_value" showname="Window size value: 32792" size="2" pos="48" show="32792" value="8018"/>
    <field name="tcp.window_size" showname="Calculated window size: 32792" size="2" pos="48" show="32792" value="8018"/>
    <field name="tcp.checksum" showname="Checksum: 0xfe30 [validation disabled]" size="2" pos="50" show="0xfe30" value="fe30">
      <field name="tcp.checksum_good" showname="Good Checksum: False" size="2" pos="50" show="0" value="fe30"/>
      <field name="tcp.checksum_bad" showname="Bad Checksum: False" size="2" pos="50" show="0" value="fe30"/>
    </field>
    <field name="tcp.options" showname="Options: (20 bytes)" size="20" pos="54" show="02:04:40:0c:04:02:08:0a:00:14:23:5e:00:00:00:00:01:03:03:07" value="0204400c0402080a0014235e0000000001030307">
      <field name="tcp.options.mss" showname="TCP MSS Option: True" hide="yes" size="4" pos="54" show="1" value="0204400c"/>
      <field name="tcp.options.mss_val" showname="Maximum segment size: 16396 bytes" size="4" pos="54" show="16396" value="0204400c"/>
      <field name="tcp.options.sack_perm" showname="TCP SACK Permitted Option: True" size="2" pos="58" show="1" value="0402"/>
      <field name="" show="Timestamps: TSval 1319774, TSecr 0" size="10" pos="60" value="080a0014235e00000000">
        <field name="tcp.option_kind" showname="Kind: Timestamp (8)" size="1" pos="60" show="8" value="08"/>
        <field name="tcp.option_len" showname="Length: 10" size="1" pos="61" show="10" value="0a"/>
        <field name="tcp.options.timestamp.tsval" showname="Timestamp value: 1319774" size="4" pos="62" show="1319774" value="0014235e"/>
        <field name="tcp.options.timestamp.tsecr" showname="Timestamp echo reply: 0" size="4" pos="66" show="0" value="00000000"/>
      </field>
      <field name="" show="No-Operation (NOP)" size="1" pos="70" value="01"/>
      <field name="" show="Window scale: 7 (multiply by 128)" size="3" pos="71" value="030307">
        <field name="tcp.option_kind" showname="Kind: Window Scale (3)" size="1" pos="71" show="3" value="03"/>
        <field name="tcp.option_len" showname="Length: 3" size="1" pos="72" show="3" value="03"/>
        <field name="tcp.options.wscale.shift" showname="Shift count: 7" size="1" pos="73" show="7" value="07"/>
        <field name="tcp.options.wscale.multiplier" showname="Multiplier: 128" size="1" pos="73" show="128" value="07"/>
      </field>
    </field>
  </proto>
</packet>


<packet>
  <proto name="geninfo" pos="0" showname="General information" size="74">
    <field name="num" pos="0" show="2" showname="Number" value="2" size="74"/>
    <field name="len" pos="0" show="74" showname="Frame Length" value="4a" size="74"/>
    <field name="caplen" pos="0" show="74" showname="Captured Length" value="4a" size="74"/>
    <field name="timestamp" pos="0" show="Apr 20, 2012 09:11:07.454226000 CEST" showname="Captured Time" value="1334905867.454226000" size="74"/>
  </proto>
  <proto name="frame" showname="Frame 2: 74 bytes on wire (592 bits), 74 bytes captured (592 bits)" size="74" pos="0">
    <field name="frame.time" showname="Arrival Time: Apr 20, 2012 09:11:07.454226000 CEST" size="0" pos="0" show="Apr 20, 2012 09:11:07.454226000"/>
    <field name="frame.time_epoch" showname="Epoch Time: 1334905867.454226000 seconds" size="0" pos="0" show="1334905867.454226000"/>
    <field name="frame.time_delta" showname="Time delta from previous captured frame: 0.000032000 seconds" size="0" pos="0" show="0.000032000"/>
    <field name="frame.time_delta_displayed" showname="Time delta from previous displayed frame: 0.000032000 seconds" size="0" pos="0" show="0.000032000"/>
    <field name="frame.time_relative" showname="Time since reference or first frame: 0.000032000 seconds" size="0" pos="0" show="0.000032000"/>
    <field name="frame.number" showname="Frame Number: 2" size="0" pos="0" show="2"/>
    <field name="frame.len" showname="Frame Length: 74 bytes (592 bits)" size="0" pos="0" show="74"/>
    <field name="frame.cap_len" showname="Capture Length: 74 bytes (592 bits)" size="0" pos="0" show="74"/>
    <field name="frame.marked" showname="Frame is marked: False" size="0" pos="0" show="0"/>
    <field name="frame.ignored" showname="Frame is ignored: False" size="0" pos="0" show="0"/>
    <field name="frame.protocols" showname="Protocols in frame: eth:ip:tcp" size="0" pos="0" show="eth:ip:tcp"/>
  </proto>
  <proto name="eth" showname="Ethernet II, Src: 00:00:00_00:00:00 (00:00:00:00:00:00), Dst: 00:00:00_00:00:00 (00:00:00:00:00:00)" size="14" pos="0">
    <field name="eth.dst" showname="Destination: 00:00:00_00:00:00 (00:00:00:00:00:00)" size="6" pos="0" show="00:00:00:00:00:00" value="000000000000">
      <field name="eth.addr" showname="Address: 00:00:00_00:00:00 (00:00:00:00:00:00)" size="6" pos="0" show="00:00:00:00:00:00" value="000000000000"/>
      <field name="eth.ig" showname=".... ...0 .... .... .... .... = IG bit: Individual address (unicast)" size="3" pos="0" show="0" value="0" unmaskedvalue="000000"/>
      <field name="eth.lg" showname=".... ..0. .... .... .... .... = LG bit: Globally unique address (factory default)" size="3" pos="0" show="0" value="0" unmaskedvalue="000000"/>
    </field>
    <field name="eth.src" showname="Source: 00:00:00_00:00:00 (00:00:00:00:00:00)" size="6" pos="6" show="00:00:00:00:00:00" value="000000000000">
      <field name="eth.addr" showname="Address: 00:00:00_00:00:00 (00:00:00:00:00:00)" size="6" pos="6" show="00:00:00:00:00:00" value="000000000000"/>
      <field name="eth.ig" showname=".... ...0 .... .... .... .... = IG bit: Individual address (unicast)" size="3" pos="6" show="0" value="0" unmaskedvalue="000000"/>
      <field name="eth.lg" showname=".... ..0. .... .... .... .... = LG bit: Globally unique address (factory default)" size="3" pos="6" show="0" value="0" unmaskedvalue="000000"/>
    </field>
    <field name="eth.type" showname="Type: IP (0x0800)" size="2" pos="12" show="0x0800" value="0800"/>
  </proto>
  <proto name="ip" showname="Internet Protocol Version 4, Src: 127.0.0.1 (127.0.0.1), Dst: 127.0.0.1 (127.0.0.1)" size="20" pos="14">
    <field name="ip.version" showname="Version: 4" size="1" pos="14" show="4" value="45"/>
    <field name="ip.hdr_len" showname="Header length: 20 bytes" size="1" pos="14" show="20" value="45"/>
    <field name="ip.dsfield" showname="Differentiated Services Field: 0x00 (DSCP 0x00: Default; ECN: 0x00: Not-ECT (Not ECN-Capable Transport))" size="1" pos="15" show="0" value="00">
      <field name="ip.dsfield.dscp" showname="0000 00.. = Differentiated Services Codepoint: Default (0x00)" size="1" pos="15" show="0x00" value="0" unmaskedvalue="00"/>
      <field name="ip.dsfield.ecn" showname=".... ..00 = Explicit Congestion Notification: Not-ECT (Not ECN-Capable Transport) (0x00)" size="1" pos="15" show="0x00" value="0" unmaskedvalue="00"/>
    </field>
    <field name="ip.len" showname="Total Length: 60" size="2" pos="16" show="60" value="003c"/>
    <field name="ip.id" showname="Identification: 0x0000 (0)" size="2" pos="18" show="0x0000" value="0000"/>
    <field name="ip.flags" showname="Flags: 0x02 (Don&apos;t Fragment)" size="1" pos="20" show="0x02" value="40">
      <field name="ip.flags.rb" showname="0... .... = Reserved bit: Not set" size="1" pos="20" show="0" value="40"/>
      <field name="ip.flags.df" showname=".1.. .... = Don&apos;t fragment: Set" size="1" pos="20" show="1" value="40"/>
      <field name="ip.flags.mf" showname="..0. .... = More fragments: Not set" size="1" pos="20" show="0" value="40"/>
    </field>
    <field name="ip.frag_offset" showname="Fragment offset: 0" size="2" pos="20" show="0" value="4000"/>
    <field name="ip.ttl" showname="Time to live: 64" size="1" pos="22" show="64" value="40"/>
    <field name="ip.proto" showname="Protocol: TCP (6)" size="1" pos="23" show="6" value="06"/>
    <field name="ip.checksum" showname="Header checksum: 0x3cba [correct]" size="2" pos="24" show="0x3cba" value="3cba">
      <field name="ip.checksum_good" showname="Good: True" size="2" pos="24" show="1" value="3cba"/>
      <field name="ip.checksum_bad" showname="Bad: False" size="2" pos="24" show="0" value="3cba"/>
    </field>
    <field name="ip.src" showname="Source: 127.0.0.1 (127.0.0.1)" size="4" pos="26" show="127.0.0.1" value="7f000001"/>
    <field name="ip.addr" showname="Source or Destination Address: 127.0.0.1 (127.0.0.1)" hide="yes" size="4" pos="26" show="127.0.0.1" value="7f000001"/>
    <field name="ip.src_host" showname="Source Host: 127.0.0.1" hide="yes" size="4" pos="26" show="127.0.0.1" value="7f000001"/>
    <field name="ip.host" showname="Source or Destination Host: 127.0.0.1" hide="yes" size="4" pos="26" show="127.0.0.1" value="7f000001"/>
    <field name="ip.dst" showname="Destination: 127.0.0.1 (127.0.0.1)" size="4" pos="30" show="127.0.0.1" value="7f000001"/>
    <field name="ip.addr" showname="Source or Destination Address: 127.0.0.1 (127.0.0.1)" hide="yes" size="4" pos="30" show="127.0.0.1" value="7f000001"/>
    <field name="ip.dst_host" showname="Destination Host: 127.0.0.1" hide="yes" size="4" pos="30" show="127.0.0.1" value="7f000001"/>
    <field name="ip.host" showname="Source or Destination Host: 127.0.0.1" hide="yes" size="4" pos="30" show="127.0.0.1" value="7f000001"/>
  </proto>
  <proto name="tcp" showname="Transmission Control Protocol, Src Port: http (80), Dst Port: 37092 (37092), Seq: 0, Ack: 1, Len: 0" size="40" pos="34">
    <field name="tcp.srcport" showname="Source port: http (80)" size="2" pos="34" show="80" value="0050"/>
    <field name="tcp.dstport" showname="Destination port: 37092 (37092)" size="2" pos="36" show="37092" value="90e4"/>
    <field name="tcp.port" showname="Source or Destination Port: 80" hide="yes" size="2" pos="34" show="80" value="0050"/>
    <field name="tcp.port" showname="Source or Destination Port: 37092" hide="yes" size="2" pos="36" show="37092" value="90e4"/>
    <field name="tcp.stream" showname="Stream index: 0" size="0" pos="34" show="0"/>
    <field name="tcp.len" showname="TCP Segment Len: 0" hide="yes" size="1" pos="46" show="0" value="a0"/>
    <field name="tcp.seq" showname="Sequence number: 0    (relative sequence number)" size="4" pos="38" show="0" value="f92fc6fc"/>
    <field name="tcp.ack" showname="Acknowledgement number: 1    (relative ack number)" size="4" pos="42" show="1" value="563d3d0c"/>
    <field name="tcp.hdr_len" showname="Header length: 40 bytes" size="1" pos="46" show="40" value="a0"/>
    <field name="tcp.flags" showname="Flags: 0x12 (SYN, ACK)" size="2" pos="46" show="0x12" value="a012">
      <field name="tcp.flags.res" showname="000. .... .... = Reserved: Not set" size="1" pos="46" show="0" value="0" unmaskedvalue="a0"/>
      <field name="tcp.flags.ns" showname="...0 .... .... = Nonce: Not set" size="1" pos="46" show="0" value="0" unmaskedvalue="a0"/>
      <field name="tcp.flags.cwr" showname=".... 0... .... = Congestion Window Reduced (CWR): Not set" size="1" pos="47" show="0" value="0" unmaskedvalue="12"/>
      <field name="tcp.flags.ecn" showname=".... .0.. .... = ECN-Echo: Not set" size="1" pos="47" show="0" value="0" unmaskedvalue="12"/>
      <field name="tcp.flags.urg" showname=".... ..0. .... = Urgent: Not set" size="1" pos="47" show="0" value="0" unmaskedvalue="12"/>
      <field name="tcp.flags.ack" showname=".... ...1 .... = Acknowledgement: Set" size="1" pos="47" show="1" value="1" unmaskedvalue="12"/>
      <field name="tcp.flags.push" showname=".... .... 0... = Push: Not set" size="1" pos="47" show="0" value="0" unmaskedvalue="12"/>
      <field name="tcp.flags.reset" showname=".... .... .0.. = Reset: Not set" size="1" pos="47" show="0" value="0" unmaskedvalue="12"/>
      <field name="tcp.flags.syn" showname=".... .... ..1. = Syn: Set" size="1" pos="47" show="1" value="1" unmaskedvalue="12">
        <proto name="expert" showname="Expert Info (Chat/Sequence): Connection establish acknowledge (SYN+ACK): server port http" size="0" pos="0">
          <field name="expert.message" showname="Message: Connection establish acknowledge (SYN+ACK): server port http" size="0" pos="0" show="Connection establish acknowledge (SYN+ACK): server port http"/>
          <field name="expert.severity" showname="Severity level: Chat" size="0" pos="0" show="Chat"/>
          <field name="expert.group" showname="Group: Sequence" size="0" pos="0" show="Sequence"/>
        </proto>
      </field>
      <field name="tcp.flags.fin" showname=".... .... ...0 = Fin: Not set" size="1" pos="47" show="0" value="0" unmaskedvalue="12"/>
    </field>
    <field name="tcp.window_size_value" showname="Window size value: 32768" size="2" pos="48" show="32768" value="8000"/>
    <field name="tcp.window_size" showname="Calculated window size: 32768" size="2" pos="48" show="32768" value="8000"/>
    <field name="tcp.checksum" showname="Checksum: 0xfe30 [validation disabled]" size="2" pos="50" show="0xfe30" value="fe30">
      <field name="tcp.checksum_good" showname="Good Checksum: False" size="2" pos="50" show="0" value="fe30"/>
      <field name="tcp.checksum_bad" showname="Bad Checksum: False" size="2" pos="50" show="0" value="fe30"/>
    </field>
    <field name="tcp.options" showname="Options: (20 bytes)" size="20" pos="54" show="02:04:40:0c:04:02:08:0a:00:14:23:5e:00:14:23:5e:01:03:03:07" value="0204400c0402080a0014235e0014235e01030307">
      <field name="tcp.options.mss" showname="TCP MSS Option: True" hide="yes" size="4" pos="54" show="1" value="0204400c"/>
      <field name="tcp.options.mss_val" showname="Maximum segment size: 16396 bytes" size="4" pos="54" show="16396" value="0204400c"/>
      <field name="tcp.options.sack_perm" showname="TCP SACK Permitted Option: True" size="2" pos="58" show="1" value="0402"/>
      <field name="" show="Timestamps: TSval 1319774, TSecr 1319774" size="10" pos="60" value="080a0014235e0014235e">
        <field name="tcp.option_kind" showname="Kind: Timestamp (8)" size="1" pos="60" show="8" value="08"/>
        <field name="tcp.option_len" showname="Length: 10" size="1" pos="61" show="10" value="0a"/>
        <field name="tcp.options.timestamp.tsval" showname="Timestamp value: 1319774" size="4" pos="62" show="1319774" value="0014235e"/>
        <field name="tcp.options.timestamp.tsecr" showname="Timestamp echo reply: 1319774" size="4" pos="66" show="1319774" value="0014235e"/>
      </field>
      <field name="" show="No-Operation (NOP)" size="1" pos="70" value="01"/>
      <field name="" show="Window scale: 7 (multiply by 128)" size="3" pos="71" value="030307">
        <field name="tcp.option_kind" showname="Kind: Window Scale (3)" size="1" pos="71" show="3" value="03"/>
        <field name="tcp.option_len" showname="Length: 3" size="1" pos="72" show="3" value="03"/>
        <field name="tcp.options.wscale.shift" showname="Shift count: 7" size="1" pos="73" show="7" value="07"/>
        <field name="tcp.options.wscale.multiplier" showname="Multiplier: 128" size="1" pos="73" show="128" value="07"/>
      </field>
    </field>
    <field name="" show="SEQ/ACK analysis" size="0" pos="34" value="">
      <field name="tcp.analysis.acks_frame" showname="This is an ACK to the segment in frame: 1" size="0" pos="34" show="1"/>
      <field name="tcp.analysis.ack_rtt" showname="The RTT to ACK the segment was: 0.000032000 seconds" size="0" pos="34" show="0.000032000"/>
    </field>
  </proto>
</packet>


<packet>
  <proto name="geninfo" pos="0" showname="General information" size="66">
    <field name="num" pos="0" show="3" showname="Number" value="3" size="66"/>
    <field name="len" pos="0" show="66" showname="Frame Length" value="42" size="66"/>
    <field name="caplen" pos="0" show="66" showname="Captured Length" value="42" size="66"/>
    <field name="timestamp" pos="0" show="Apr 20, 2012 09:11:07.454246000 CEST" showname="Captured Time" value="1334905867.454246000" size="66"/>
  </proto>
  <proto name="frame" showname="Frame 3: 66 bytes on wire (528 bits), 66 bytes captured (528 bits)" size="66" pos="0">
    <field name="frame.time" showname="Arrival Time: Apr 20, 2012 09:11:07.454246000 CEST" size="0" pos="0" show="Apr 20, 2012 09:11:07.454246000"/>
    <field name="frame.time_epoch" showname="Epoch Time: 1334905867.454246000 seconds" size="0" pos="0" show="1334905867.454246000"/>
    <field name="frame.time_delta" showname="Time delta from previous captured frame: 0.000020000 seconds" size="0" pos="0" show="0.000020000"/>
    <field name="frame.time_delta_displayed" showname="Time delta from previous displayed frame: 0.000020000 seconds" size="0" pos="0" show="0.000020000"/>
    <field name="frame.time_relative" showname="Time since reference or first frame: 0.000052000 seconds" size="0" pos="0" show="0.000052000"/>
    <field name="frame.number" showname="Frame Number: 3" size="0" pos="0" show="3"/>
    <field name="frame.len" showname="Frame Length: 66 bytes (528 bits)" size="0" pos="0" show="66"/>
    <field name="frame.cap_len" showname="Capture Length: 66 bytes (528 bits)" size="0" pos="0" show="66"/>
    <field name="frame.marked" showname="Frame is marked: False" size="0" pos="0" show="0"/>
    <field name="frame.ignored" showname="Frame is ignored: False" size="0" pos="0" show="0"/>
    <field name="frame.protocols" showname="Protocols in frame: eth:ip:tcp" size="0" pos="0" show="eth:ip:tcp"/>
  </proto>
  <proto name="eth" showname="Ethernet II, Src: 00:00:00_00:00:00 (00:00:00:00:00:00), Dst: 00:00:00_00:00:00 (00:00:00:00:00:00)" size="14" pos="0">
    <field name="eth.dst" showname="Destination: 00:00:00_00:00:00 (00:00:00:00:00:00)" size="6" pos="0" show="00:00:00:00:00:00" value="000000000000">
      <field name="eth.addr" showname="Address: 00:00:00_00:00:00 (00:00:00:00:00:00)" size="6" pos="0" show="00:00:00:00:00:00" value="000000000000"/>
      <field name="eth.ig" showname=".... ...0 .... .... .... .... = IG bit: Individual address (unicast)" size="3" pos="0" show="0" value="0" unmaskedvalue="000000"/>
      <field name="eth.lg" showname=".... ..0. .... .... .... .... = LG bit: Globally unique address (factory default)" size="3" pos="0" show="0" value="0" unmaskedvalue="000000"/>
    </field>
    <field name="eth.src" showname="Source: 00:00:00_00:00:00 (00:00:00:00:00:00)" size="6" pos="6" show="00:00:00:00:00:00" value="000000000000">
      <field name="eth.addr" showname="Address: 00:00:00_00:00:00 (00:00:00:00:00:00)" size="6" pos="6" show="00:00:00:00:00:00" value="000000000000"/>
      <field name="eth.ig" showname=".... ...0 .... .... .... .... = IG bit: Individual address (unicast)" size="3" pos="6" show="0" value="0" unmaskedvalue="000000"/>
      <field name="eth.lg" showname=".... ..0. .... .... .... .... = LG bit: Globally unique address (factory default)" size="3" pos="6" show="0" value="0" unmaskedvalue="000000"/>
    </field>
    <field name="eth.type" showname="Type: IP (0x0800)" size="2" pos="12" show="0x0800" value="0800"/>
  </proto>
  <proto name="ip" showname="Internet Protocol Version 4, Src: 127.0.0.1 (127.0.0.1), Dst: 127.0.0.1 (127.0.0.1)" size="20" pos="14">
    <field name="ip.version" showname="Version: 4" size="1" pos="14" show="4" value="45"/>
    <field name="ip.hdr_len" showname="Header length: 20 bytes" size="1" pos="14" show="20" value="45"/>
    <field name="ip.dsfield" showname="Differentiated Services Field: 0x00 (DSCP 0x00: Default; ECN: 0x00: Not-ECT (Not ECN-Capable Transport))" size="1" pos="15" show="0" value="00">
      <field name="ip.dsfield.dscp" showname="0000 00.. = Differentiated Services Codepoint: Default (0x00)" size="1" pos="15" show="0x00" value="0" unmaskedvalue="00"/>
      <field name="ip.dsfield.ecn" showname=".... ..00 = Explicit Congestion Notification: Not-ECT (Not ECN-Capable Transport) (0x00)" size="1" pos="15" show="0x00" value="0" unmaskedvalue="00"/>
    </field>
    <field name="ip.len" showname="Total Length: 52" size="2" pos="16" show="52" value="0034"/>
    <field name="ip.id" showname="Identification: 0x1e56 (7766)" size="2" pos="18" show="0x1e56" value="1e56"/>
    <field name="ip.flags" showname="Flags: 0x02 (Don&apos;t Fragment)" size="1" pos="20" show="0x02" value="40">
      <field name="ip.flags.rb" showname="0... .... = Reserved bit: Not set" size="1" pos="20" show="0" value="40"/>
      <field name="ip.flags.df" showname=".1.. .... = Don&apos;t fragment: Set" size="1" pos="20" show="1" value="40"/>
      <field name="ip.flags.mf" showname="..0. .... = More fragments: Not set" size="1" pos="20" show="0" value="40"/>
    </field>
    <field name="ip.frag_offset" showname="Fragment offset: 0" size="2" pos="20" show="0" value="4000"/>
    <field name="ip.ttl" showname="Time to live: 64" size="1" pos="22" show="64" value="40"/>
    <field name="ip.proto" showname="Protocol: TCP (6)" size="1" pos="23" show="6" value="06"/>
    <field name="ip.checksum" showname="Header checksum: 0x1e6c [correct]" size="2" pos="24" show="0x1e6c" value="1e6c">
      <field name="ip.checksum_good" showname="Good: True" size="2" pos="24" show="1" value="1e6c"/>
      <field name="ip.checksum_bad" showname="Bad: False" size="2" pos="24" show="0" value="1e6c"/>
    </field>
    <field name="ip.src" showname="Source: 127.0.0.1 (127.0.0.1)" size="4" pos="26" show="127.0.0.1" value="7f000001"/>
    <field name="ip.addr" showname="Source or Destination Address: 127.0.0.1 (127.0.0.1)" hide="yes" size="4" pos="26" show="127.0.0.1" value="7f000001"/>
    <field name="ip.src_host" showname="Source Host: 127.0.0.1" hide="yes" size="4" pos="26" show="127.0.0.1" value="7f000001"/>
    <field name="ip.host" showname="Source or Destination Host: 127.0.0.1" hide="yes" size="4" pos="26" show="127.0.0.1" value="7f000001"/>
    <field name="ip.dst" showname="Destination: 127.0.0.1 (127.0.0.1)" size="4" pos="30" show="127.0.0.1" value="7f000001"/>
    <field name="ip.addr" showname="Source or Destination Address: 127.0.0.1 (127.0.0.1)" hide="yes" size="4" pos="30" show="127.0.0.1" value="7f000001"/>
    <field name="ip.dst_host" showname="Destination Host: 127.0.0.1" hide="yes" size="4" pos="30" show="127.0.0.1" value="7f000001"/>
    <field name="ip.host" showname="Source or Destination Host: 127.0.0.1" hide="yes" size="4" pos="30" show="127.0.0.1" value="7f000001"/>
  </proto>
  <proto name="tcp" showname="Transmission Control Protocol, Src Port: 37092 (37092), Dst Port: http (80), Seq: 1, Ack: 1, Len: 0" size="32" pos="34">
    <field name="tcp.srcport" showname="Source port: 37092 (37092)" size="2" pos="34" show="37092" value="90e4"/>
    <field name="tcp.dstport" showname="Destination port: http (80)" size="2" pos="36" show="80" value="0050"/>
    <field name="tcp.port" showname="Source or Destination Port: 37092" hide="yes" size="2" pos="34" show="37092" value="90e4"/>
    <field name="tcp.port" showname="Source or Destination Port: 80" hide="yes" size="2" pos="36" show="80" value="0050"/>
    <field name="tcp.stream" showname="Stream index: 0" size="0" pos="34" show="0"/>
    <field name="tcp.len" showname="TCP Segment Len: 0" hide="yes" size="1" pos="46" show="0" value="80"/>
    <field name="tcp.seq" showname="Sequence number: 1    (relative sequence number)" size="4" pos="38" show="1" value="563d3d0c"/>
    <field name="tcp.ack" showname="Acknowledgement number: 1    (relative ack number)" size="4" pos="42" show="1" value="f92fc6fd"/>
    <field name="tcp.hdr_len" showname="Header length: 32 bytes" size="1" pos="46" show="32" value="80"/>
    <field name="tcp.flags" showname="Flags: 0x10 (ACK)" size="2" pos="46" show="0x10" value="8010">
      <field name="tcp.flags.res" showname="000. .... .... = Reserved: Not set" size="1" pos="46" show="0" value="0" unmaskedvalue="80"/>
      <field name="tcp.flags.ns" showname="...0 .... .... = Nonce: Not set" size="1" pos="46" show="0" value="0" unmaskedvalue="80"/>
      <field name="tcp.flags.cwr" showname=".... 0... .... = Congestion Window Reduced (CWR): Not set" size="1" pos="47" show="0" value="0" unmaskedvalue="10"/>
      <field name="tcp.flags.ecn" showname=".... .0.. .... = ECN-Echo: Not set" size="1" pos="47" show="0" value="0" unmaskedvalue="10"/>
      <field name="tcp.flags.urg" showname=".... ..0. .... = Urgent: Not set" size="1" pos="47" show="0" value="0" unmaskedvalue="10"/>
      <field name="tcp.flags.ack" showname=".... ...1 .... = Acknowledgement: Set" size="1" pos="47" show="1" value="1" unmaskedvalue="10"/>
      <field name="tcp.flags.push" showname=".... .... 0... = Push: Not set" size="1" pos="47" show="0" value="0" unmaskedvalue="10"/>
      <field name="tcp.flags.reset" showname=".... .... .0.. = Reset: Not set" size="1" pos="47" show="0" value="0" unmaskedvalue="10"/>
      <field name="tcp.flags.syn" showname=".... .... ..0. = Syn: Not set" size="1" pos="47" show="0" value="0" unmaskedvalue="10"/>
      <field name="tcp.flags.fin" showname=".... .... ...0 = Fin: Not set" size="1" pos="47" show="0" value="0" unmaskedvalue="10"/>
    </field>
    <field name="tcp.window_size_value" showname="Window size value: 257" size="2" pos="48" show="257" value="0101"/>
    <field name="tcp.window_size" showname="Calculated window size: 32896" size="2" pos="48" show="32896" value="0101"/>
    <field name="tcp.window_size_scalefactor" showname="Window size scaling factor: 128" size="2" pos="48" show="128" value="0101"/>
    <field name="tcp.checksum" showname="Checksum: 0xfe28 [validation disabled]" size="2" pos="50" show="0xfe28" value="fe28">
      <field name="tcp.checksum_good" showname="Good Checksum: False" size="2" pos="50" show="0" value="fe28"/>
      <field name="tcp.checksum_bad" showname="Bad Checksum: False" size="2" pos="50" show="0" value="fe28"/>
    </field>
    <field name="tcp.options" showname="Options: (12 bytes)" size="12" pos="54" show="01:01:08:0a:00:14:23:5e:00:14:23:5e" value="0101080a0014235e0014235e">
      <field name="" show="No-Operation (NOP)" size="1" pos="54" value="01"/>
      <field name="" show="No-Operation (NOP)" size="1" pos="55" value="01"/>
      <field name="" show="Timestamps: TSval 1319774, TSecr 1319774" size="10" pos="56" value="080a0014235e0014235e">
        <field name="tcp.option_kind" showname="Kind: Timestamp (8)" size="1" pos="56" show="8" value="08"/>
        <field name="tcp.option_len" showname="Length: 10" size="1" pos="57" show="10" value="0a"/>
        <field name="tcp.options.timestamp.tsval" showname="Timestamp value: 1319774" size="4" pos="58" show="1319774" value="0014235e"/>
        <field name="tcp.options.timestamp.tsecr" showname="Timestamp echo reply: 1319774" size="4" pos="62" show="1319774" value="0014235e"/>
      </field>
    </field>
    <field name="" show="SEQ/ACK analysis" size="0" pos="34" value="">
      <field name="tcp.analysis.acks_frame" showname="This is an ACK to the segment in frame: 2" size="0" pos="34" show="2"/>
      <field name="tcp.analysis.ack_rtt" showname="The RTT to ACK the segment was: 0.000020000 seconds" size="0" pos="34" show="0.000020000"/>
    </field>
  </proto>
</packet>


<packet>
  <proto name="geninfo" pos="0" showname="General information" size="74">
    <field name="num" pos="0" show="4" showname="Number" value="4" size="74"/>
    <field name="len" pos="0" show="74" showname="Frame Length" value="4a" size="74"/>
    <field name="caplen" pos="0" show="74" showname="Captured Length" value="4a" size="74"/>
    <field name="timestamp" pos="0" show="Apr 20, 2012 09:11:07.454945000 CEST" showname="Captured Time" value="1334905867.454945000" size="74"/>
  </proto>
  <proto name="frame" showname="Frame 4: 74 bytes on wire (592 bits), 74 bytes captured (592 bits)" size="74" pos="0">
    <field name="frame.time" showname="Arrival Time: Apr 20, 2012 09:11:07.454945000 CEST" size="0" pos="0" show="Apr 20, 2012 09:11:07.454945000"/>
    <field name="frame.time_epoch" showname="Epoch Time: 1334905867.454945000 seconds" size="0" pos="0" show="1334905867.454945000"/>
    <field name="frame.time_delta" showname="Time delta from previous captured frame: 0.000699000 seconds" size="0" pos="0" show="0.000699000"/>
    <field name="frame.time_delta_displayed" showname="Time delta from previous displayed frame: 0.000699000 seconds" size="0" pos="0" show="0.000699000"/>
    <field name="frame.time_relative" showname="Time since reference or first frame: 0.000751000 seconds" size="0" pos="0" show="0.000751000"/>
    <field name="frame.number" showname="Frame Number: 4" size="0" pos="0" show="4"/>
    <field name="frame.len" showname="Frame Length: 74 bytes (592 bits)" size="0" pos="0" show="74"/>
    <field name="frame.cap_len" showname="Capture Length: 74 bytes (592 bits)" size="0" pos="0" show="74"/>
    <field name="frame.marked" showname="Frame is marked: False" size="0" pos="0" show="0"/>
    <field name="frame.ignored" showname="Frame is ignored: False" size="0" pos="0" show="0"/>
    <field name="frame.protocols" showname="Protocols in frame: eth:ip:tcp" size="0" pos="0" show="eth:ip:tcp"/>
  </proto>
  <proto name="eth" showname="Ethernet II, Src: 00:00:00_00:00:00 (00:00:00:00:00:00), Dst: 00:00:00_00:00:00 (00:00:00:00:00:00)" size="14" pos="0">
    <field name="eth.dst" showname="Destination: 00:00:00_00:00:00 (00:00:00:00:00:00)" size="6" pos="0" show="00:00:00:00:00:00" value="000000000000">
      <field name="eth.addr" showname="Address: 00:00:00_00:00:00 (00:00:00:00:00:00)" size="6" pos="0" show="00:00:00:00:00:00" value="000000000000"/>
      <field name="eth.ig" showname=".... ...0 .... .... .... .... = IG bit: Individual address (unicast)" size="3" pos="0" show="0" value="0" unmaskedvalue="000000"/>
