<?xml version="1.0"?>
<pdml>
  <packet>
    <proto name="geninfo" pos="0" showname="General information" size="74">
      <field name="num" pos="0" show="13" showname="Number" value="d" size="74"/>
      <field name="len" pos="0" show="74" showname="Frame Length" value="4a" size="74"/>
      <field name="caplen" pos="0" show="74" showname="Captured Length" value="4a" size="74"/>
      <field name="timestamp" pos="0" show="Apr 20, 2012 09:11:07.455720000 CEST" showname="Captured Time" value="1334905867.455720000" size="74"/>
    </proto>
    <proto name="frame" showname="Frame 13: 74 bytes on wire (592 bits), 74 bytes captured (592 bits)" size="74" pos="0">
      <field name="frame.time" showname="Arrival Time: Apr 20, 2012 09:11:07.455720000 CEST" size="0" pos="0" show="Apr 20, 2012 09:11:07.455720000"/>
      <field name="frame.time_epoch" showname="Epoch Time: 1334905867.455720000 seconds" size="0" pos="0" show="1334905867.455720000"/>
      <field name="frame.time_delta" showname="Time delta from previous captured frame: 0.000218000 seconds" size="0" pos="0" show="0.000218000"/>
      <field name="frame.time_delta_displayed" showname="Time delta from previous displayed frame: 0.000218000 seconds" size="0" pos="0" show="0.000218000"/>
      <field name="frame.time_relative" showname="Time since reference or first frame: 0.001526000 seconds" size="0" pos="0" show="0.001526000"/>
      <field name="frame.number" showname="Frame Number: 13" size="0" pos="0" show="13"/>
      <field name="frame.len" showname="Frame Length: 74 bytes (592 bits)" size="0" pos="0" show="74"/>
      <field name="frame.cap_len" showname="Capture Length: 74 bytes (592 bits)" size="0" pos="0" show="74"/>
      <field name="frame.marked" showname="Frame is marked: False" size="0" pos="0" show="0"/>
      <field name="frame.ignored" showname="Frame is ignored: False" size="0" pos="0" show="0"/>
      <field name="frame.protocols" showname="Protocols in frame: eth:ip:tcp" size="0" pos="0" show="eth:ip:tcp"/>
    </proto>
    <proto name="eth" showname="Ethernet II, Src: 00:00:00_00:00:00 (00:00:00:00:00:00), Dst: 00:00:00_00:00:00 (00:00:00:00:00:00)" size="14" pos="0">
      <field name="eth.dst" showname="Destination: 00:00:00_00:00:00 (00:00:00:00:00:00)" size="6" pos="0" show="00:00:00:00:00:00" value="000000000000">
        <field name="eth.addr" showname="Address: 00:00:00_00:00:00 (00:00:00:00:00:00)" size="6" pos="0" show="00:00:00:00:00:00" value="000000000000"/>
        <field name="eth.ig" showname=".... ...0 .... .... .... .... = IG bit: Individual address (unicast)" size="3" pos="0" show="0" value="0" unmaskedvalue="000000"/>
        <field name="eth.lg" showname=".... ..0. .... .... .... .... = LG bit: Globally unique address (factory default)" size="3" pos="0" show="0" value="0" unmaskedvalue="000000"/>
      </field>
      <field name="eth.src" showname="Source: 00:00:00_00:00:00 (00:00:00:00:00:00)" size="6" pos="6" show="00:00:00:00:00:00" value="000000000000">
        <field name="eth.addr" showname="Address: 00:00:00_00:00:00 (00:00:00:00:00:00)" size="6" pos="6" show="00:00:00:00:00:00" value="000000000000"/>
        <field name="eth.ig" showname=".... ...0 .... .... .... .... = IG bit: Individual address (unicast)" size="3" pos="6" show="0" value="0" unmaskedvalue="000000"/>
        <field name="eth.lg" showname=".... ..0. .... .... .... .... = LG bit: Globally unique address (factory default)" size="3" pos="6" show="0" value="0" unmaskedvalue="000000"/>
      </field>
      <field name="eth.type" showname="Type: IP (0x0800)" size="2" pos="12" show="0x0800" value="0800"/>
    </proto>
    <proto name="ip" showname="Internet Protocol Version 4, Src: 127.0.0.1 (127.0.0.1), Dst: 127.0.0.1 (127.0.0.1)" size="20" pos="14">
      <field name="ip.version" showname="Version: 4" size="1" pos="14" show="4" value="45"/>
      <field name="ip.hdr_len" showname="Header length: 20 bytes" size="1" pos="14" show="20" value="45"/>
      <field name="ip.dsfield" showname="Differentiated Services Field: 0x00 (DSCP 0x00: Default; ECN: 0x00: Not-ECT (Not ECN-Capable Transport))" size="1" pos="15" show="0" value="00">
        <field name="ip.dsfield.dscp" showname="0000 00.. = Differentiated Services Codepoint: Default (0x00)" size="1" pos="15" show="0x00" value="0" unmaskedvalue="00"/>
        <field name="ip.dsfield.ecn" showname=".... ..00 = Explicit Congestion Notification: Not-ECT (Not ECN-Capable Transport) (0x00)" size="1" pos="15" show="0x00" value="0" unmaskedvalue="00"/>
      </field>
      <field name="ip.len" showname="Total Length: 60" size="2" pos="16" show="60" value="003c"/>
      <field name="ip.id" showname="Identification: 0x0713 (1811)" size="2" pos="18" show="0x0713" value="0713"/>
      <field name="ip.flags" showname="Flags: 0x02 (Don't Fragment)" size="1" pos="20" show="0x02" value="40">
        <field name="ip.flags.rb" showname="0... .... = Reserved bit: Not set" size="1" pos="20" show="0" value="40"/>
        <field name="ip.flags.df" showname=".1.. .... = Don't fragment: Set" size="1" pos="20" show="1" value="40"/>
        <field name="ip.flags.mf" showname="..0. .... = More fragments: Not set" size="1" pos="20" show="0" value="40"/>
      </field>
      <field name="ip.frag_offset" showname="Fragment offset: 0" size="2" pos="20" show="0" value="4000"/>
      <field name="ip.ttl" showname="Time to live: 64" size="1" pos="22" show="64" value="40"/>
      <field name="ip.proto" showname="Protocol: TCP (6)" size="1" pos="23" show="6" value="06"/>
      <field name="ip.checksum" showname="Header checksum: 0x35a7 [correct]" size="2" pos="24" show="0x35a7" value="35a7">
        <field name="ip.checksum_good" showname="Good: True" size="2" pos="24" show="1" value="35a7"/>
        <field name="ip.checksum_bad" showname="Bad: False" size="2" pos="24" show="0" value="35a7"/>
      </field>
      <field name="ip.src" showname="Source: 127.0.0.1 (127.0.0.1)" size="4" pos="26" show="127.0.0.1" value="7f000001"/>
      <field name="ip.addr" showname="Source or Destination Address: 127.0.0.1 (127.0.0.1)" hide="yes" size="4" pos="26" show="127.0.0.1" value="7f000001"/>
      <field name="ip.src_host" showname="Source Host: 127.0.0.1" hide="yes" size="4" pos="26" show="127.0.0.1" value="7f000001"/>
      <field name="ip.host" showname="Source or Destination Host: 127.0.0.1" hide="yes" size="4" pos="26" show="127.0.0.1" value="7f000001"/>
      <field name="ip.dst" showname="Destination: 127.0.0.1 (127.0.0.1)" size="4" pos="30" show="127.0.0.1" value="7f000001"/>
      <field name="ip.addr" showname="Source or Destination Address: 127.0.0.1 (127.0.0.1)" hide="yes" size="4" pos="30" show="127.0.0.1" value="7f000001"/>
      <field name="ip.dst_host" showname="Destination Host: 127.0.0.1" hide="yes" size="4" pos="30" show="127.0.0.1" value="7f000001"/>
      <field name="ip.host" showname="Source or Destination Host: 127.0.0.1" hide="yes" size="4" pos="30" show="127.0.0.1" value="7f000001"/>
    </proto>
    <proto name="tcp" showname="Transmission Control Protocol, Src Port: 37096 (37096), Dst Port: http (80), Seq: 0, Len: 0" size="40" pos="34">
      <field name="tcp.srcport" showname="Source port: 37096 (37096)" size="2" pos="34" show="37096" value="90e8"/>
      <field name="tcp.dstport" showname="Destination port: http (80)" size="2" pos="36" show="80" value="0050"/>
      <field name="tcp.port" showname="Source or Destination Port: 37096" hide="yes" size="2" pos="34" show="37096" value="90e8"/>
      <field name="tcp.port" showname="Source or Destination Port: 80" hide="yes" size="2" pos="36" show="80" value="0050"/>
      <field name="tcp.stream" showname="Stream index: 4" size="0" pos="34" show="4"/>
      <field name="tcp.len" showname="TCP Segment Len: 0" hide="yes" size="1" pos="46" show="0" value="a0"/>
      <field name="tcp.seq" showname="Sequence number: 0    (relative sequence number)" size="4" pos="38" show="0" value="24ec244d"/>
      <field name="tcp.hdr_len" showname="Header length: 40 bytes" size="1" pos="46" show="40" value="a0"/>
      <field name="tcp.flags" showname="Flags: 0x02 (SYN)" size="2" pos="46" show="0x02" value="a002">
        <field name="tcp.flags.res" showname="000. .... .... = Reserved: Not set" size="1" pos="46" show="0" value="0" unmaskedvalue="a0"/>
        <field name="tcp.flags.ns" showname="...0 .... .... = Nonce: Not set" size="1" pos="46" show="0" value="0" unmaskedvalue="a0"/>
        <field name="tcp.flags.cwr" showname=".... 0... .... = Congestion Window Reduced (CWR): Not set" size="1" pos="47" show="0" value="0" unmaskedvalue="02"/>
        <field name="tcp.flags.ecn" showname=".... .0.. .... = ECN-Echo: Not set" size="1" pos="47" show="0" value="0" unmaskedvalue="02"/>
        <field name="tcp.flags.urg" showname=".... ..0. .... = Urgent: Not set" size="1" pos="47" show="0" value="0" unmaskedvalue="02"/>
        <field name="tcp.flags.ack" showname=".... ...0 .... = Acknowledgement: Not set" size="1" pos="47" show="0" value="0" unmaskedvalue="02"/>
        <field name="tcp.flags.push" showname=".... .... 0... = Push: Not set" size="1" pos="47" show="0" value="0" unmaskedvalue="02"/>
        <field name="tcp.flags.reset" showname=".... .... .0.. = Reset: Not set" size="1" pos="47" show="0" value="0" unmaskedvalue="02"/>
        <field name="tcp.flags.syn" showname=".... .... ..1. = Syn: Set" size="1" pos="47" show="1" value="1" unmaskedvalue="02">
          <proto name="expert" showname="Expert Info (Chat/Sequence): Connection establish request (SYN): server port http" size="0" pos="0">
            <field name="expert.message" showname="Message: Connection establish request (SYN): server port http" size="0" pos="0" show="Connection establish request (SYN): server port http"/>
            <field name="expert.severity" showname="Severity level: Chat" size="0" pos="0" show="Chat"/>
            <field name="expert.group" showname="Group: Sequence" size="0" pos="0" show="Sequence"/>
          </proto>
        </field>
        <field name="tcp.flags.fin" showname=".... .... ...0 = Fin: Not set" size="1" pos="47" show="0" value="0" unmaskedvalue="02"/>
      </field>
      <field name="tcp.window_size_value" showname="Window size value: 32792" size="2" pos="48" show="32792" value="8018"/>
      <field name="tcp.window_size" showname="Calculated window size: 32792" size="2" pos="48" show="32792" value="8018"/>
      <field name="tcp.checksum" showname="Checksum: 0xfe30 [validation disabled]" size="2" pos="50" show="0xfe30" value="fe30">
        <field name="tcp.checksum_good" showname="Good Checksum: False" size="2" pos="50" show="0" value="fe30"/>
        <field name="tcp.checksum_bad" showname="Bad Checksum: False" size="2" pos="50" show="0" value="fe30"/>
      </field>
      <field name="tcp.options" showname="Options: (20 bytes)" size="20" pos="54" show="02:04:40:0c:04:02:08:0a:00:14:23:5e:00:00:00:00:01:03:03:07" value="0204400c0402080a0014235e0000000001030307">
        <field name="tcp.options.mss" showname="TCP MSS Option: True" hide="yes" size="4" pos="54" show="1" value="0204400c"/>
        <field name="tcp.options.mss_val" showname="Maximum segment size: 16396 bytes" size="4" pos="54" show="16396" value="0204400c"/>
        <field name="tcp.options.sack_perm" showname="TCP SACK Permitted Option: True" size="2" pos="58" show="1" value="0402"/>
        <field name="" show="Timestamps: TSval 1319774, TSecr 0" size="10" pos="60" value="080a0014235e00000000">
          <field name="tcp.option_kind" showname="Kind: Timestamp (8)" size="1" pos="60" show="8" value="08"/>
          <field name="tcp.option_len" showname="Length: 10" size="1" pos="61" show="10" value="0a"/>
          <field name="tcp.options.timestamp.tsval" showname="Timestamp value: 1319774" size="4" pos="62" show="1319774" value="0014235e"/>
          <field name="tcp.options.timestamp.tsecr" showname="Timestamp echo reply: 0" size="4" pos="66" show="0" value="00000000"/>
        </field>
        <field name="" show="No-Operation (NOP)" size="1" pos="70" value="01"/>
        <field name="" show="Window scale: 7 (multiply by 128)" size="3" pos="71" value="030307">
          <field name="tcp.option_kind" showname="Kind: Window Scale (3)" size="1" pos="71" show="3" value="03"/>
          <field name="tcp.option_len" showname="Length: 3" size="1" pos="72" show="3" value="03"/>
          <field name="tcp.options.wscale.shift" showname="Shift count: 7" size="1" pos="73" show="7" value="07"/>
          <field name="tcp.options.wscale.multiplier" showname="Multiplier: 128" size="1" pos="73" show="128" value="07"/>
        </field>
      </field>
    </proto>
  </packet>


  <packet>
    <proto name="geninfo" pos="0" showname="General information" size="74">
      <field name="num" pos="0" show="14" showname="Number" value="e" size="74"/>
      <field name="len" pos="0" show="74" showname="Frame Length" value="4a" size="74"/>
      <field name="caplen" pos="0" show="74" showname="Captured Length" value="4a" size="74"/>
      <field name="timestamp" pos="0" show="Apr 20, 2012 09:11:07.455738000 CEST" showname="Captured Time" value="1334905867.455738000" size="74"/>
    </proto>
    <proto name="frame" showname="Frame 14: 74 bytes on wire (592 bits), 74 bytes captured (592 bits)" size="74" pos="0">
      <field name="frame.time" showname="Arrival Time: Apr 20, 2012 09:11:07.455738000 CEST" size="0" pos="0" show="Apr 20, 2012 09:11:07.455738000"/>
      <field name="frame.time_epoch" showname="Epoch Time: 1334905867.455738000 seconds" size="0" pos="0" show="1334905867.455738000"/>
      <field name="frame.time_delta" showname="Time delta from previous captured frame: 0.000018000 seconds" size="0" pos="0" show="0.000018000"/>
      <field name="frame.time_delta_displayed" showname="Time delta from previous displayed frame: 0.000018000 seconds" size="0" pos="0" show="0.000018000"/>
      <field name="frame.time_relative" showname="Time since reference or first frame: 0.001544000 seconds" size="0" pos="0" show="0.001544000"/>
      <field name="frame.number" showname="Frame Number: 14" size="0" pos="0" show="14"/>
      <field name="frame.len" showname="Frame Length: 74 bytes (592 bits)" size="0" pos="0" show="74"/>
      <field name="frame.cap_len" showname="Capture Length: 74 bytes (592 bits)" size="0" pos="0" show="74"/>
      <field name="frame.marked" showname="Frame is marked: False" size="0" pos="0" show="0"/>
      <field name="frame.ignored" showname="Frame is ignored: False" size="0" pos="0" show="0"/>
      <field name="frame.protocols" showname="Protocols in frame: eth:ip:tcp" size="0" pos="0" show="eth:ip:tcp"/>
    </proto>
    <proto name="eth" showname="Ethernet II, Src: 00:00:00_00:00:00 (00:00:00:00:00:00), Dst: 00:00:00_00:00:00 (00:00:00:00:00:00)" size="14" pos="0">
      <field name="eth.dst" showname="Destination: 00:00:00_00:00:00 (00:00:00:00:00:00)" size="6" pos="0" show="00:00:00:00:00:00" value="000000000000">
        <field name="eth.addr" showname="Address: 00:00:00_00:00:00 (00:00:00:00:00:00)" size="6" pos="0" show="00:00:00:00:00:00" value="000000000000"/>
        <field name="eth.ig" showname=".... ...0 .... .... .... .... = IG bit: Individual address (unicast)" size="3" pos="0" show="0" value="0" unmaskedvalue="000000"/>
        <field name="eth.lg" showname=".... ..0. .... .... .... .... = LG bit: Globally unique address (factory default)" size="3" pos="0" show="0" value="0" unmaskedvalue="000000"/>
      </field>
      <field name="eth.src" showname="Source: 00:00:00_00:00:00 (00:00:00:00:00:00)" size="6" pos="6" show="00:00:00:00:00:00" value="000000000000">
        <field name="eth.addr" showname="Address: 00:00:00_00:00:00 (00:00:00:00:00:00)" size="6" pos="6" show="00:00:00:00:00:00" value="000000000000"/>
        <field name="eth.ig" showname=".... ...0 .... .... .... .... = IG bit: Individual address (unicast)" size="3" pos="6" show="0" value="0" unmaskedvalue="000000"/>
        <field name="eth.lg" showname=".... ..0. .... .... .... .... = LG bit: Globally unique address (factory default)" size="3" pos="6" show="0" value="0" unmaskedvalue="000000"/>
      </field>
      <field name="eth.type" showname="Type: IP (0x0800)" size="2" pos="12" show="0x0800" value="0800"/>
    </proto>
    <proto name="ip" showname="Internet Protocol Version 4, Src: 127.0.0.1 (127.0.0.1), Dst: 127.0.0.1 (127.0.0.1)" size="20" pos="14">
      <field name="ip.version" showname="Version: 4" size="1" pos="14" show="4" value="45"/>
      <field name="ip.hdr_len" showname="Header length: 20 bytes" size="1" pos="14" show="20" value="45"/>
      <field name="ip.dsfield" showname="Differentiated Services Field: 0x00 (DSCP 0x00: Default; ECN: 0x00: Not-ECT (Not ECN-Capable Transport))" size="1" pos="15" show="0" value="00">
        <field name="ip.dsfield.dscp" showname="0000 00.. = Differentiated Services Codepoint: Default (0x00)" size="1" pos="15" show="0x00" value="0" unmaskedvalue="00"/>
        <field name="ip.dsfield.ecn" showname=".... ..00 = Explicit Congestion Notification: Not-ECT (Not ECN-Capable Transport) (0x00)" size="1" pos="15" show="0x00" value="0" unmaskedvalue="00"/>
      </field>
      <field name="ip.len" showname="Total Length: 60" size="2" pos="16" show="60" value="003c"/>
      <field name="ip.id" showname="Identification: 0x0000 (0)" size="2" pos="18" show="0x0000" value="0000"/>
      <field name="ip.flags" showname="Flags: 0x02 (Don't Fragment)" size="1" pos="20" show="0x02" value="40">
        <field name="ip.flags.rb" showname="0... .... = Reserved bit: Not set" size="1" pos="20" show="0" value="40"/>
        <field name="ip.flags.df" showname=".1.. .... = Don't fragment: Set" size="1" pos="20" show="1" value="40"/>
        <field name="ip.flags.mf" showname="..0. .... = More fragments: Not set" size="1" pos="20" show="0" value="40"/>
      </field>
      <field name="ip.frag_offset" showname="Fragment offset: 0" size="2" pos="20" show="0" value="4000"/>
      <field name="ip.ttl" showname="Time to live: 64" size="1" pos="22" show="64" value="40"/>
      <field name="ip.proto" showname="Protocol: TCP (6)" size="1" pos="23" show="6" value="06"/>
      <field name="ip.checksum" showname="Header checksum: 0x3cba [correct]" size="2" pos="24" show="0x3cba" value="3cba">
        <field name="ip.checksum_good" showname="Good: True" size="2" pos="24" show="1" value="3cba"/>
        <field name="ip.checksum_bad" showname="Bad: False" size="2" pos="24" show="0" value="3cba"/>
      </field>
      <field name="ip.src" showname="Source: 127.0.0.1 (127.0.0.1)" size="4" pos="26" show="127.0.0.1" value="7f000001"/>
      <field name="ip.addr" showname="Source or Destination Address: 127.0.0.1 (127.0.0.1)" hide="yes" size="4" pos="26" show="127.0.0.1" value="7f000001"/>
      <field name="ip.src_host" showname="Source Host: 127.0.0.1" hide="yes" size="4" pos="26" show="127.0.0.1" value="7f000001"/>
      <field name="ip.host" showname="Source or Destination Host: 127.0.0.1" hide="yes" size="4" pos="26" show="127.0.0.1" value="7f000001"/>
      <field name="ip.dst" showname="Destination: 127.0.0.1 (127.0.0.1)" size="4" pos="30" show="127.0.0.1" value="7f000001"/>
      <field name="ip.addr" showname="Source or Destination Address: 127.0.0.1 (127.0.0.1)" hide="yes" size="4" pos="30" show="127.0.0.1" value="7f000001"/>
      <field name="ip.dst_host" showname="Destination Host: 127.0.0.1" hide="yes" size="4" pos="30" show="127.0.0.1" value="7f000001"/>
      <field name="ip.host" showname="Source or Destination Host: 127.0.0.1" hide="yes" size="4" pos="30" show="127.0.0.1" value="7f000001"/>
    </proto>
    <proto name="tcp" showname="Transmission Control Protocol, Src Port: http (80), Dst Port: 37096 (37096), Seq: 0, Ack: 1, Len: 0" size="40" pos="34">
      <field name="tcp.srcport" showname="Source port: http (80)" size="2" pos="34" show="80" value="0050"/>
      <field name="tcp.dstport" showname="Destination port: 37096 (37096)" size="2" pos="36" show="37096" value="90e8"/>
      <field name="tcp.port" showname="Source or Destination Port: 80" hide="yes" size="2" pos="34" show="80" value="0050"/>
      <field name="tcp.port" showname="Source or Destination Port: 37096" hide="yes" size="2" pos="36" show="37096" value="90e8"/>
      <field name="tcp.stream" showname="Stream index: 4" size="0" pos="34" show="4"/>
      <field name="tcp.len" showname="TCP Segment Len: 0" hide="yes" size="1" pos="46" show="0" value="a0"/>
      <field name="tcp.seq" showname="Sequence number: 0    (relative sequence number)" size="4" pos="38" show="0" value="b9454a91"/>
      <field name="tcp.ack" showname="Acknowledgement number: 1    (relative ack number)" size="4" pos="42" show="1" value="24ec244e"/>
      <field name="tcp.hdr_len" showname="Header length: 40 bytes" size="1" pos="46" show="40" value="a0"/>
      <field name="tcp.flags" showname="Flags: 0x12 (SYN, ACK)" size="2" pos="46" show="0x12" value="a012">
        <field name="tcp.flags.res" showname="000. .... .... = Reserved: Not set" size="1" pos="46" show="0" value="0" unmaskedvalue="a0"/>
        <field name="tcp.flags.ns" showname="...0 .... .... = Nonce: Not set" size="1" pos="46" show="0" value="0" unmaskedvalue="a0"/>
        <field name="tcp.flags.cwr" showname=".... 0... .... = Congestion Window Reduced (CWR): Not set" size="1" pos="47" show="0" value="0" unmaskedvalue="12"/>
        <field name="tcp.flags.ecn" showname=".... .0.. .... = ECN-Echo: Not set" size="1" pos="47" show="0" value="0" unmaskedvalue="12"/>
        <field name="tcp.flags.urg" showname=".... ..0. .... = Urgent: Not set" size="1" pos="47" show="0" value="0" unmaskedvalue="12"/>
        <field name="tcp.flags.ack" showname=".... ...1 .... = Acknowledgement: Set" size="1" pos="47" show="1" value="1" unmaskedvalue="12"/>
        <field name="tcp.flags.push" showname=".... .... 0... = Push: Not set" size="1" pos="47" show="0" value="0" unmaskedvalue="12"/>
        <field name="tcp.flags.reset" showname=".... .... .0.. = Reset: Not set" size="1" pos="47" show="0" value="0" unmaskedvalue="12"/>
        <field name="tcp.flags.syn" showname=".... .... ..1. = Syn: Set" size="1" pos="47" show="1" value="1" unmaskedvalue="12">
          <proto name="expert" showname="Expert Info (Chat/Sequence): Connection establish acknowledge (SYN+ACK): server port http" size="0" pos="0">
            <field name="expert.message" showname="Message: Connection establish acknowledge (SYN+ACK): server port http" size="0" pos="0" show="Connection establish acknowledge (SYN+ACK): server port http"/>
            <field name="expert.severity" showname="Severity level: Chat" size="0" pos="0" show="Chat"/>
            <field name="expert.group" showname="Group: Sequence" size="0" pos="0" show="Sequence"/>
          </proto>
        </field>
        <field name="tcp.flags.fin" showname=".... .... ...0 = Fin: Not set" size="1" pos="47" show="0" value="0" unmaskedvalue="12"/>
      </field>
      <field name="tcp.window_size_value" showname="Window size value: 32768" size="2" pos="48" show="32768" value="8000"/>
      <field name="tcp.window_size" showname="Calculated window size: 32768" size="2" pos="48" show="32768" value="8000"/>
      <field name="tcp.checksum" showname="Checksum: 0xfe30 [validation disabled]" size="2" pos="50" show="0xfe30" value="fe30">
        <field name="tcp.checksum_good" showname="Good Checksum: False" size="2" pos="50" show="0" value="fe30"/>
        <field name="tcp.checksum_bad" showname="Bad Checksum: False" size="2" pos="50" show="0" value="fe30"/>
      </field>
      <field name="tcp.options" showname="Options: (20 bytes)" size="20" pos="54" show="02:04:40:0c:04:02:08:0a:00:14:23:5e:00:14:23:5e:01:03:03:07" value="0204400c0402080a0014235e0014235e01030307">
        <field name="tcp.options.mss" showname="TCP MSS Option: True" hide="yes" size="4" pos="54" show="1" value="0204400c"/>
        <field name="tcp.options.mss_val" showname="Maximum segment size: 16396 bytes" size="4" pos="54" show="16396" value="0204400c"/>
        <field name="tcp.options.sack_perm" showname="TCP SACK Permitted Option: True" size="2" pos="58" show="1" value="0402"/>
        <field name="" show="Timestamps: TSval 1319774, TSecr 1319774" size="10" pos="60" value="080a0014235e0014235e">
          <field name="tcp.option_kind" showname="Kind: Timestamp (8)" size="1" pos="60" show="8" value="08"/>
          <field name="tcp.option_len" showname="Length: 10" size="1" pos="61" show="10" value="0a"/>
          <field name="tcp.options.timestamp.tsval" showname="Timestamp value: 1319774" size="4" pos="62" show="1319774" value="0014235e"/>
          <field name="tcp.options.timestamp.tsecr" showname="Timestamp echo reply: 1319774" size="4" pos="66" show="1319774" value="0014235e"/>
        </field>
        <field name="" show="No-Operation (NOP)" size="1" pos="70" value="01"/>
        <field name="" show="Window scale: 7 (multiply by 128)" size="3" pos="71" value="030307">
          <field name="tcp.option_kind" showname="Kind: Window Scale (3)" size="1" pos="71" show="3" value="03"/>
          <field name="tcp.option_len" showname="Length: 3" size="1" pos="72" show="3" value="03"/>
          <field name="tcp.options.wscale.shift" showname="Shift count: 7" size="1" pos="73" show="7" value="07"/>
          <field name="tcp.options.wscale.multiplier" showname="Multiplier: 128" size="1" pos="73" show="128" value="07"/>
        </field>
      </field>
      <field name="" show="SEQ/ACK analysis" size="0" pos="34" value="">
        <field name="tcp.analysis.acks_frame" showname="This is an ACK to the segment in frame: 13" size="0" pos="34" show="13"/>
        <field name="tcp.analysis.ack_rtt" showname="The RTT to ACK the segment was: 0.000018000 seconds" size="0" pos="34" show="0.000018000"/>
      </field>
    </proto>
  </packet>


  <packet>
    <proto name="geninfo" pos="0" showname="General information" size="66">
      <field name="num" pos="0" show="15" showname="Number" value="f" size="66"/>
      <field name="len" pos="0" show="66" showname="Frame Length" value="42" size="66"/>
      <field name="caplen" pos="0" show="66" showname="Captured Length" value="42" size="66"/>
      <field name="timestamp" pos="0" show="Apr 20, 2012 09:11:07.455751000 CEST" showname="Captured Time" value="1334905867.455751000" size="66"/>
    </proto>
    <proto name="frame" showname="Frame 15: 66 bytes on wire (528 bits), 66 bytes captured (528 bits)" size="66" pos="0">
      <field name="frame.time" showname="Arrival Time: Apr 20, 2012 09:11:07.455751000 CEST" size="0" pos="0" show="Apr 20, 2012 09:11:07.455751000"/>
      <field name="frame.time_epoch" showname="Epoch Time: 1334905867.455751000 seconds" size="0" pos="0" show="1334905867.455751000"/>
      <field name="frame.time_delta" showname="Time delta from previous captured frame: 0.000013000 seconds" size="0" pos="0" show="0.000013000"/>
      <field name="frame.time_delta_displayed" showname="Time delta from previous displayed frame: 0.000013000 seconds" size="0" pos="0" show="0.000013000"/>
      <field name="frame.time_relative" showname="Time since reference or first frame: 0.001557000 seconds" size="0" pos="0" show="0.001557000"/>
      <field name="frame.number" showname="Frame Number: 15" size="0" pos="0" show="15"/>
      <field name="frame.len" showname="Frame Length: 66 bytes (528 bits)" size="0" pos="0" show="66"/>
      <field name="frame.cap_len" showname="Capture Length: 66 bytes (528 bits)" size="0" pos="0" show="66"/>
      <field name="frame.marked" showname="Frame is marked: False" size="0" pos="0" show="0"/>
      <field name="frame.ignored" showname="Frame is ignored: False" size="0" pos="0" show="0"/>
      <field name="frame.protocols" showname="Protocols in frame: eth:ip:tcp" size="0" pos="0" show="eth:ip:tcp"/>
    </proto>
    <proto name="eth" showname="Ethernet II, Src: 00:00:00_00:00:00 (00:00:00:00:00:00), Dst: 00:00:00_00:00:00 (00:00:00:00:00:00)" size="14" pos="0">
      <field name="eth.dst" showname="Destination: 00:00:00_00:00:00 (00:00:00:00:00:00)" size="6" pos="0" show="00:00:00:00:00:00" value="000000000000">
        <field name="eth.addr" showname="Address: 00:00:00_00:00:00 (00:00:00:00:00:00)" size="6" pos="0" show="00:00:00:00:00:00" value="000000000000"/>
        <field name="eth.ig" showname=".... ...0 .... .... .... .... = IG bit: Individual address (unicast)" size="3" pos="0" show="0" value="0" unmaskedvalue="000000"/>
        <field name="eth.lg" showname=".... ..0. .... .... .... .... = LG bit: Globally unique address (factory default)" size="3" pos="0" show="0" value="0" unmaskedvalue="000000"/>
      </field>
      <field name="eth.src" showname="Source: 00:00:00_00:00:00 (00:00:00:00:00:00)" size="6" pos="6" show="00:00:00:00:00:00" value="000000000000">
        <field name="eth.addr" showname="Address: 00:00:00_00:00:00 (00:00:00:00:00:00)" size="6" pos="6" show="00:00:00:00:00:00" value="000000000000"/>
        <field name="eth.ig" showname=".... ...0 .... .... .... .... = IG bit: Individual address (unicast)" size="3" pos="6" show="0" value="0" unmaskedvalue="000000"/>
        <field name="eth.lg" showname=".... ..0. .... .... .... .... = LG bit: Globally unique address (factory default)" size="3" pos="6" show="0" value="0" unmaskedvalue="000000"/>
      </field>
      <field name="eth.type" showname="Type: IP (0x0800)" size="2" pos="12" show="0x0800" value="0800"/>
    </proto>
    <proto name="ip" showname="Internet Protocol Version 4, Src: 127.0.0.1 (127.0.0.1), Dst: 127.0.0.1 (127.0.0.1)" size="20" pos="14">
      <field name="ip.version" showname="Version: 4" size="1" pos="14" show="4" value="45"/>
      <field name="ip.hdr_len" showname="Header length: 20 bytes" size="1" pos="14" show="20" value="45"/>
      <field name="ip.dsfield" showname="Differentiated Services Field: 0x00 (DSCP 0x00: Default; ECN: 0x00: Not-ECT (Not ECN-Capable Transport))" size="1" pos="15" show="0" value="00">
        <field name="ip.dsfield.dscp" showname="0000 00.. = Differentiated Services Codepoint: Default (0x00)" size="1" pos="15" show="0x00" value="0" unmaskedvalue="00"/>
        <field name="ip.dsfield.ecn" showname=".... ..00 = Explicit Congestion Notification: Not-ECT (Not ECN-Capable Transport) (0x00)" size="1" pos="15" show="0x00" value="0" unmaskedvalue="00"/>
      </field>
      <field name="ip.len" showname="Total Length: 52" size="2" pos="16" show="52" value="0034"/>
      <field name="ip.id" showname="Identification: 0x0714 (1812)" size="2" pos="18" show="0x0714" value="0714"/>
      <field name="ip.flags" showname="Flags: 0x02 (Don't Fragment)" size="1" pos="20" show="0x02" value="40">
        <field name="ip.flags.rb" showname="0... .... = Reserved bit: Not set" size="1" pos="20" show="0" value="40"/>
        <field name="ip.flags.df" showname=".1.. .... = Don't fragment: Set" size="1" pos="20" show="1" value="40"/>
        <field name="ip.flags.mf" showname="..0. .... = More fragments: Not set" size="1" pos="20" show="0" value="40"/>
      </field>
      <field name="ip.frag_offset" showname="Fragment offset: 0" size="2" pos="20" show="0" value="4000"/>
      <field name="ip.ttl" showname="Time to live: 64" size="1" pos="22" show="64" value="40"/>
      <field name="ip.proto" showname="Protocol: TCP (6)" size="1" pos="23" show="6" value="06"/>
      <field name="ip.checksum" showname="Header checksum: 0x35ae [correct]" size="2" pos="24" show="0x35ae" value="35ae">
        <field name="ip.checksum_good" showname="Good: True" size="2" pos="24" show="1" value="35ae"/>
        <field name="ip.checksum_bad" showname="Bad: False" size="2" pos="24" show="0" value="35ae"/>
      </field>
      <field name="ip.src" showname="Source: 127.0.0.1 (127.0.0.1)" size="4" pos="26" show="127.0.0.1" value="7f000001"/>
      <field name="ip.addr" showname="Source or Destination Address: 127.0.0.1 (127.0.0.1)" hide="yes" size="4" pos="26" show="127.0.0.1" value="7f000001"/>
      <field name="ip.src_host" showname="Source Host: 127.0.0.1" hide="yes" size="4" pos="26" show="127.0.0.1" value="7f000001"/>
      <field name="ip.host" showname="Source or Destination Host: 127.0.0.1" hide="yes" size="4" pos="26" show="127.0.0.1" value="7f000001"/>
      <field name="ip.dst" showname="Destination: 127.0.0.1 (127.0.0.1)" size="4" pos="30" show="127.0.0.1" value="7f000001"/>
      <field name="ip.addr" showname="Source or Destination Address: 127.0.0.1 (127.0.0.1)" hide="yes" size="4" pos="30" show="127.0.0.1" value="7f000001"/>
      <field name="ip.dst_host" showname="Destination Host: 127.0.0.1" hide="yes" size="4" pos="30" show="127.0.0.1" value="7f000001"/>
      <field name="ip.host" showname="Source or Destination Host: 127.0.0.1" hide="yes" size="4" pos="30" show="127.0.0.1" value="7f000001"/>
    </proto>
    <proto name="tcp" showname="Transmission Control Protocol, Src Port: 37096 (37096), Dst Port: http (80), Seq: 1, Ack: 1, Len: 0" size="32" pos="34">
      <field name="tcp.srcport" showname="Source port: 37096 (37096)" size="2" pos="34" show="37096" value="90e8"/>
      <field name="tcp.dstport" showname="Destination port: http (80)" size="2" pos="36" show="80" value="0050"/>
      <field name="tcp.port" showname="Source or Destination Port: 37096" hide="yes" size="2" pos="34" show="37096" value="90e8"/>
      <field name="tcp.port" showname="Source or Destination Port: 80" hide="yes" size="2" pos="36" show="80" value="0050"/>
      <field name="tcp.stream" showname="Stream index: 4" size="0" pos="34" show="4"/>
      <field name="tcp.len" showname="TCP Segment Len: 0" hide="yes" size="1" pos="46" show="0" value="80"/>
      <field name="tcp.seq" showname="Sequence number: 1    (relative sequence number)" size="4" pos="38" show="1" value="24ec244e"/>
      <field name="tcp.ack" showname="Acknowledgement number: 1    (relative ack number)" size="4" pos="42" show="1" value="b9454a92"/>
      <field name="tcp.hdr_len" showname="Header length: 32 bytes" size="1" pos="46" show="32" value="80"/>
      <field name="tcp.flags" showname="Flags: 0x10 (ACK)" size="2" pos="46" show="0x10" value="8010">
        <field name="tcp.flags.res" showname="000. .... .... = Reserved: Not set" size="1" pos="46" show="0" value="0" unmaskedvalue="80"/>
        <field name="tcp.flags.ns" showname="...0 .... .... = Nonce: Not set" size="1" pos="46" show="0" value="0" unmaskedvalue="80"/>
        <field name="tcp.flags.cwr" showname=".... 0... .... = Congestion Window Reduced (CWR): Not set" size="1" pos="47" show="0" value="0" unmaskedvalue="10"/>
        <field name="tcp.flags.ecn" showname=".... .0.. .... = ECN-Echo: Not set" size="1" pos="47" show="0" value="0" unmaskedvalue="10"/>
        <field name="tcp.flags.urg" showname=".... ..0. .... = Urgent: Not set" size="1" pos="47" show="0" value="0" unmaskedvalue="10"/>
        <field name="tcp.flags.ack" showname=".... ...1 .... = Acknowledgement: Set" size="1" pos="47" show="1" value="1" unmaskedvalue="10"/>
        <field name="tcp.flags.push" showname=".... .... 0... = Push: Not set" size="1" pos="47" show="0" value="0" unmaskedvalue="10"/>
        <field name="tcp.flags.reset" showname=".... .... .0.. = Reset: Not set" size="1" pos="47" show="0" value="0" unmaskedvalue="10"/>
        <field name="tcp.flags.syn" showname=".... .... ..0. = Syn: Not set" size="1" pos="47" show="0" value="0" unmaskedvalue="10"/>
        <field name="tcp.flags.fin" showname=".... .... ...0 = Fin: Not set" size="1" pos="47" show="0" value="0" unmaskedvalue="10"/>
      </field>
      <field name="tcp.window_size_value" showname="Window size value: 257" size="2" pos="48" show="257" value="0101"/>
      <field name="tcp.window_size" showname="Calculated window size: 32896" size="2" pos="48" show="32896" value="0101"/>
      <field name="tcp.window_size_scalefactor" showname="Window size scaling factor: 128" size="2" pos="48" show="128" value="0101"/>
      <field name="tcp.checksum" showname="Checksum: 0xfe28 [validation disabled]" size="2" pos="50" show="0xfe28" value="fe28">
        <field name="tcp.checksum_good" showname="Good Checksum: False" size="2" pos="50" show="0" value="fe28"/>
        <field name="tcp.checksum_bad" showname="Bad Checksum: False" size="2" pos="50" show="0" value="fe28"/>
      </field>
      <field name="tcp.options" showname="Options: (12 bytes)" size="12" pos="54" show="01:01:08:0a:00:14:23:5e:00:14:23:5e" value="0101080a0014235e0014235e">
        <field name="" show="No-Operation (NOP)" size="1" pos="54" value="01"/>
        <field name="" show="No-Operation (NOP)" size="1" pos="55" value="01"/>
        <field name="" show="Timestamps: TSval 1319774, TSecr 1319774" size="10" pos="56" value="080a0014235e0014235e">
          <field name="tcp.option_kind" showname="Kind: Timestamp (8)" size="1" pos="56" show="8" value="08"/>
          <field name="tcp.option_len" showname="Length: 10" size="1" pos="57" show="10" value="0a"/>
          <field name="tcp.options.timestamp.tsval" showname="Timestamp value: 1319774" size="4" pos="58" show="1319774" value="0014235e"/>
          <field name="tcp.options.timestamp.tsecr" showname="Timestamp echo reply: 1319774" size="4" pos="62" show="1319774" value="0014235e"/>
        </field>
      </field>
      <field name="" show="SEQ/ACK analysis" size="0" pos="34" value="">
        <field name="tcp.analysis.acks_frame" showname="This is an ACK to the segment in frame: 14" size="0" pos="34" show="14"/>
        <field name="tcp.analysis.ack_rtt" showname="The RTT to ACK the segment was: 0.000013000 seconds" size="0" pos="34" show="0.000013000"/>
      </field>
    </proto>
  </packet>


  <packet>
    <proto name="geninfo" pos="0" showname="General information" size="538">
      <field name="num" pos="0" show="44" showname="Number" value="2c" size="538"/>
      <field name="len" pos="0" show="538" showname="Frame Length" value="21a" size="538"/>
      <field name="caplen" pos="0" show="538" showname="Captured Length" value="21a" size="538"/>
      <field name="timestamp" pos="0" show="Apr 20, 2012 09:11:07.542610000 CEST" showname="Captured Time" value="1334905867.542610000" size="538"/>
    </proto>
    <proto name="frame" showname="Frame 44: 538 bytes on wire (4304 bits), 538 bytes captured (4304 bits)" size="538" pos="0">
      <field name="frame.time" showname="Arrival Time: Apr 20, 2012 09:11:07.542610000 CEST" size="0" pos="0" show="Apr 20, 2012 09:11:07.542610000"/>
      <field name="frame.time_epoch" showname="Epoch Time: 1334905867.542610000 seconds" size="0" pos="0" show="1334905867.542610000"/>
      <field name="frame.time_delta" showname="Time delta from previous captured frame: 0.000033000 seconds" size="0" pos="0" show="0.000033000"/>
      <field name="frame.time_delta_displayed" showname="Time delta from previous displayed frame: 0.000033000 seconds" size="0" pos="0" show="0.000033000"/>
      <field name="frame.time_relative" showname="Time since reference or first frame: 0.088416000 seconds" size="0" pos="0" show="0.088416000"/>
      <field name="frame.number" showname="Frame Number: 44" size="0" pos="0" show="44"/>
      <field name="frame.len" showname="Frame Length: 538 bytes (4304 bits)" size="0" pos="0" show="538"/>
      <field name="frame.cap_len" showname="Capture Length: 538 bytes (4304 bits)" size="0" pos="0" show="538"/>
      <field name="frame.marked" showname="Frame is marked: False" size="0" pos="0" show="0"/>
      <field name="frame.ignored" showname="Frame is ignored: False" size="0" pos="0" show="0"/>
      <field name="frame.protocols" showname="Protocols in frame: eth:ip:tcp:http" size="0" pos="0" show="eth:ip:tcp:http"/>
    </proto>
    <proto name="eth" showname="Ethernet II, Src: 00:00:00_00:00:00 (00:00:00:00:00:00), Dst: 00:00:00_00:00:00 (00:00:00:00:00:00)" size="14" pos="0">
